{
  "authority_write": false,
  "candidate_counts": {
    "decisions": 1,
    "evidence": 1,
    "global_candidates": 1,
    "open_tasks": 1,
    "questions": 1
  },
  "closure_digest": "61d1d257e1a5ae61c52f43b820f5ca69561b9303da2c669a6930a6535daad3b7",
  "closure_id": "closure:10000000-0000-4000-8000-000000000001",
  "created_at": "2026-07-24T04:00:00Z",
  "expected_revision": 0,
  "fixture_only": true,
  "global_outbox_state": "pending_review",
  "global_write": false,
  "operation": "commit",
  "previous_revision": 0,
  "project_id": "v2-fixture",
  "project_write_state": "committed_synthetic",
  "receipt_digest": "0b4798644149c63a5eb90af20077159d1a45192b227f93853da3b0c63812b9e8",
  "receipt_id": "project-auto-receipt:10000000-0000-4000-8000-000000000402",
  "rollback_of_transaction_id": null,
  "schema_version": 1,
  "state_digest": "b85616614f211d3bdb3bfc935a33debec7a635b80d2f8ab07a3a2c3f0f6d5b8e",
  "state_revision": 1,
  "task_outcome": "completed",
  "transaction_id": "project-auto:10000000-0000-4000-8000-000000000401"
}
